"Lead Agency","Scientific Name","Common Name","Current
ESA Listing Status  ","Initial Listing Date","Group"
"FWS","Pekania pennanti","Fisher (SSN DPS)","Endangered","2020/06/15","<div>Mammals</div>"
"FWS","Martes caurina","Marten, Pacific (Wherever found)","Threatened","2020/11/09","<div>Mammals</div>"
"FWS","Laterallus jamaicensis ssp. jamaicensis","rail, Eastern Black (Wherever found)","Threatened","2020/11/09","<div>Birds</div>"
"FWS","Euchloe ausonides insulanus","Butterfly, Island marble (Wherever found)","Endangered","2020/06/04","<div>Insects</div>"